{
  "schemaVersion": "1.0",
  "packageVersion": "1.0.0-dev",
  "buildNumber": 24,
  "channel": "Development",
  "engineVersion": "1.0.0-dev",
  "baselineVersion": "1.0.0",
  "generatedUtc": "2026-08-20T21:17:23.496321Z",
  "hashAlgorithm": "SHA256",
  "trustAnchor": {
    "relativePath": "Start-DERIntuneBuilder.ps1",
    "manifestHashConstant": "DERPackageManifestSHA256",
    "design": "The parent launcher pins this manifest hash. Release packages Authenticode-sign the parent after this hash is embedded; the manifest then pins all protected child/package content."
  },
  "protectedFiles": [
    {
      "path": "BUILD-STATUS.md",
      "sha256": "c767752fe336595eb1a7422ecb3d0ac96b280dfb8802ff181c79f703e201ae27",
      "bytes": 5669,
      "role": "Metadata"
    },
    {
      "path": "Core/DER.Adoption.psm1",
      "sha256": "b3dc47d775b0d84f0407cb67dfac20c0d8773c971ee627fb3d378d3c2b017003",
      "bytes": 32258,
      "role": "Core"
    },
    {
      "path": "Core/DER.Analysis.psm1",
      "sha256": "0ad52535284857ce8f5ba60a9a3b322b6d3e73b2d3d1f90bd4cbfa68ac4d5733",
      "bytes": 20188,
      "role": "Core"
    },
    {
      "path": "Core/DER.Authentication.psm1",
      "sha256": "30d4efd69404c93294487b6d2552c42cedb32add4654fecae26add6b7ce4611f",
      "bytes": 14781,
      "role": "Core"
    },
    {
      "path": "Core/DER.Canary.psm1",
      "sha256": "96adb31b7874be096fd2f5cdcb55a940c42ba96f3d76227dbe67603dfac98aed",
      "bytes": 29181,
      "role": "Core"
    },
    {
      "path": "Core/DER.Discovery.psm1",
      "sha256": "01bf8dd3be1c7f2b60ce89b3c939902dddc7cd169335ee3795fc65fa0cbe79c9",
      "bytes": 21795,
      "role": "Core"
    },
    {
      "path": "Core/DER.DryRun.psm1",
      "sha256": "114050182220e1231232dfcfed61c5f6f3f40aac1892868292bd4ad67103d8f0",
      "bytes": 15925,
      "role": "Core"
    },
    {
      "path": "Core/DER.Graph.psm1",
      "sha256": "ab81ddd10b60b337e58c3030c6520c956f10554dc48a5c0bea818154bff3b3ed",
      "bytes": 51060,
      "role": "Core"
    },
    {
      "path": "Core/DER.IntegrationTest.psm1",
      "sha256": "78cf380444043c7765ef32acdf1eefe83fbcc222cd8afab6695841a8c8df75b7",
      "bytes": 21154,
      "role": "Core"
    },
    {
      "path": "Core/DER.Logging.psm1",
      "sha256": "3b9a289acd88c341ad2077c9db7cada1b24db791d6f2b31623a5caabcdfef827",
      "bytes": 44093,
      "role": "Core"
    },
    {
      "path": "Core/DER.Permissions.psm1",
      "sha256": "3f53517a1d37a6dd57393ade20cd42976d40fcfbd9ab3d8aaa29107ca7e0c2fe",
      "bytes": 5898,
      "role": "Core"
    },
    {
      "path": "Core/DER.Pilot.psm1",
      "sha256": "363c095de1ac03a990859afb893c10307498a8728b79acb640a567af947e95fe",
      "bytes": 31581,
      "role": "Core"
    },
    {
      "path": "Core/DER.Planner.psm1",
      "sha256": "28c615aa23b3f213ff4d8e9978c1e44d0b7bc46d2d125ccc0e7827811ca3a3f1",
      "bytes": 25345,
      "role": "Core"
    },
    {
      "path": "Core/DER.Questionnaire.psm1",
      "sha256": "dae184b6f6599d68d7887cc135e885d1fd73d8bf1413826564b63cf5d91386be",
      "bytes": 31582,
      "role": "Core"
    },
    {
      "path": "Core/DER.Recovery.psm1",
      "sha256": "bc05854defae816ef3c5c5a264277981907ae242282d0f0a52ad353559915cec",
      "bytes": 25376,
      "role": "Core"
    },
    {
      "path": "Core/DER.Reporting.psm1",
      "sha256": "53af9cd12fe0371458cf1db5796033c09fdf751d6c2d5441077f354c12562862",
      "bytes": 28412,
      "role": "Core"
    },
    {
      "path": "Core/DER.Rollback.psm1",
      "sha256": "e4b978055d378009f67ccd9c50a0ff77565bb2b6b7731127b859cdef5f57d200",
      "bytes": 32361,
      "role": "Core"
    },
    {
      "path": "Core/DER.Snapshot.psm1",
      "sha256": "4631c3a3d37c2bf08762d6596a611a3283bc2a8092953adda0e1565df2d5aec7",
      "bytes": 17067,
      "role": "Core"
    },
    {
      "path": "Core/DER.State.psm1",
      "sha256": "e028aef03f4fb905997cff20cb186fc519b894a8113538cd2107a4e2a4cfad39",
      "bytes": 49047,
      "role": "Core"
    },
    {
      "path": "Core/DER.Validation.psm1",
      "sha256": "155dbbc50e5e9acfd7422c99eea05a646aa51074bf2b0eff5478645c6d3d0803",
      "bytes": 27062,
      "role": "Core"
    },
    {
      "path": "Definitions/Adoption/DER-AdoptionCatalog.json",
      "sha256": "846a8ef9af3b20f480af1159995f5824df7b4e02346b9c3a74b7bd8c3bac71f6",
      "bytes": 8567,
      "role": "Definition"
    },
    {
      "path": "Definitions/Baselines/1.0.0/DER-Baseline.index.json",
      "sha256": "f809fad34cd5131e50299bf286b1ce9db2ab70d3d0c58748190ff34987714f0f",
      "bytes": 21234,
      "role": "Definition"
    },
    {
      "path": "Definitions/Baselines/1.0.0/DER-Baseline.json",
      "sha256": "c2af619f2de39a47d743abb7dd531f085bb68d18c657b4107f2949a720fb6757",
      "bytes": 5184,
      "role": "Definition"
    },
    {
      "path": "Definitions/Baselines/1.0.0/DER-Baseline.manifest.json",
      "sha256": "eb76f7a85d02c560e5a4a99e5ee260f643536b9bfc15948d6c5d770bb8731953",
      "bytes": 440,
      "role": "Definition"
    },
    {
      "path": "Definitions/Canary/DER-CanaryPolicy.json",
      "sha256": "e7c49d573d24b81e2d606c2aae7a687365faaaea12c3ab357c1fb1a0eef512d4",
      "bytes": 2239,
      "role": "Definition"
    },
    {
      "path": "Definitions/Compatibility/DER-CompatibilityCatalog.json",
      "sha256": "c5e52d4ad929899b614ec8746ae37d4c600d6eda1564a5249e9b88d5cf5c5a22",
      "bytes": 12008,
      "role": "Definition"
    },
    {
      "path": "Definitions/Integration/DER-TestTenantIntegrationPolicy.json",
      "sha256": "99e3936ee7ca2d56ac0ac78b1e1803f05a3cccf8fd4b3b4a21145a56e11f23ed",
      "bytes": 2208,
      "role": "Definition"
    },
    {
      "path": "Definitions/Package/DER-DependencyLock.json",
      "sha256": "261c059041ccbd249a838bdcd807c66f70d4fb5d1680c0dbb35a32d5f2953778",
      "bytes": 901,
      "role": "Definition"
    },
    {
      "path": "Definitions/Package/DER-SigningPolicy.json",
      "sha256": "c43df19a3d490ea3bf4b37533e11d765a05432e69e2623ec5b41fb769e1b5779",
      "bytes": 1017,
      "role": "Definition"
    },
    {
      "path": "Definitions/Package/DER-UpdateManifest.json",
      "sha256": "0d2df2de1f7c7fe59965439715697f4a2280d414ee4849f82d129e219c6b6d10",
      "bytes": 1190,
      "role": "Definition"
    },
    {
      "path": "Definitions/Pilot/DER-PilotPolicy.json",
      "sha256": "df9ce5305bdf9beb09157d59a19e761e99089a8323f88d8e60f4d056688158ba",
      "bytes": 2513,
      "role": "Definition"
    },
    {
      "path": "Definitions/Portal/DER-PortalPathCatalog.json",
      "sha256": "cd86045fe72b7654e3ae203c19f45785d06f248f5d720ee894e6a9398a07ba98",
      "bytes": 15459,
      "role": "Definition"
    },
    {
      "path": "Definitions/Recovery/DER-RecoveryPolicy.json",
      "sha256": "e98e923f507bc97667a9c891d7b7ea0bd846b6add54a8460db6fdf640a15f166",
      "bytes": 2654,
      "role": "Definition"
    },
    {
      "path": "Definitions/Release/DER-DevFreezePolicy.json",
      "sha256": "0f5a2119d08c6a06e1b152272f4de887b45c0ddd5e4c1260c3a1075673bab381",
      "bytes": 2480,
      "role": "Definition"
    },
    {
      "path": "Definitions/Schema/DER-AdoptionCatalog.schema.json",
      "sha256": "e79140e600f5242cc66c8ea76ddb1c7844893abdec867ce8a4cc3705184c324f",
      "bytes": 2705,
      "role": "Schema"
    },
    {
      "path": "Definitions/Schema/DER-AdoptionDecisions.schema.json",
      "sha256": "d52d4e002dad2d13e355b0fd66e6a388f9847a026a9faa81926075ba78c31291",
      "bytes": 1822,
      "role": "Schema"
    },
    {
      "path": "Definitions/Schema/DER-CanaryEvidence.schema.json",
      "sha256": "ccdf46caf8c4d09ba476544f13bccc16ac60f99a53411f4f94638ec3b8c4083d",
      "bytes": 3919,
      "role": "Schema"
    },
    {
      "path": "Definitions/Schema/DER-CanaryPolicy.schema.json",
      "sha256": "31d695343b583ab5792b5f58177ba1b9e59adf9b62738e7876164d402a04c690",
      "bytes": 3042,
      "role": "Schema"
    },
    {
      "path": "Definitions/Schema/DER-Definition.schema.json",
      "sha256": "50fad9d60f683ee11db5c8a8f324831aa6c775706f2218a52c1cf0a0383df270",
      "bytes": 3860,
      "role": "Schema"
    },
    {
      "path": "Definitions/Schema/DER-DependencyLock.schema.json",
      "sha256": "7da066dc0d4cdc232b37ba6e6f9fcc294709d9ab32d8a67bcf3e0ea0f39b177e",
      "bytes": 2931,
      "role": "Schema"
    },
    {
      "path": "Definitions/Schema/DER-DevCertification.schema.json",
      "sha256": "8c82a40849349208fadf63fee45c801a73eb482d5e9f1c134869593266f33a20",
      "bytes": 2655,
      "role": "Schema"
    },
    {
      "path": "Definitions/Schema/DER-DevFreezePolicy.schema.json",
      "sha256": "13f6c22b31d4ab192aaff0373f3a5313b638be8cf354de1c0c70b366dbbbf9be",
      "bytes": 4098,
      "role": "Schema"
    },
    {
      "path": "Definitions/Schema/DER-NoWriteEvidence.schema.json",
      "sha256": "361972fea6bb921ecbd6c34b39afa77335fddec1318f3181c0fbd180d3d75b0a",
      "bytes": 5197,
      "role": "Schema"
    },
    {
      "path": "Definitions/Schema/DER-PackageManifest.schema.json",
      "sha256": "16671cea9f22f0b4f6c5c397f6e087e4c7054c6a81db41a19fc6fa4aa0b961be",
      "bytes": 2476,
      "role": "Schema"
    },
    {
      "path": "Definitions/Schema/DER-PilotEvidence.schema.json",
      "sha256": "d7c70958b65041aa196a9313278c9ed0f3004ec9f175c60fe66c5a485594b3c9",
      "bytes": 5036,
      "role": "Schema"
    },
    {
      "path": "Definitions/Schema/DER-PilotPolicy.schema.json",
      "sha256": "8e592b8dc323006edf60fe855a0921258631f68f30f9f6d6d2b943dd846dc9fd",
      "bytes": 4321,
      "role": "Schema"
    },
    {
      "path": "Definitions/Schema/DER-PortableState.schema.json",
      "sha256": "1e6375b7152e3483204e87d364ad19e7dda55577fd772b8cc052a6e0eb7fde34",
      "bytes": 1911,
      "role": "Schema"
    },
    {
      "path": "Definitions/Schema/DER-PortalPathCatalog.schema.json",
      "sha256": "634f38596af4beff4b2c69c9a3a3a3f64539599f7d75efed46be3f685c9a9bdf",